title,author,dt,views,shares,abody,comments
Android Users Spread App Which Empties Bank Accounts,William Suberg,2017-07-07 10:10:00,15232,471,"Researchers have discovered a new virus which uses Android phones to empty victims’ bank accounts via mobile banking.Russian cyber security firm Group-IB initially reported the presence of the unnamed virus Wednesday, advising its spread is ongoing.Masquerading as an MMS message from a user’s phone contact, the virus delivers a link, clicking on which unpacks the virus via an app.The malicious program then gains admin privileges to Android, sending further messages to contacts and requesting fund transfers from any linked bank accounts via SMS.Victims are greeted with the following message at the start:“Dear user, you have received an SMS photograph. You can view it using the link below.”As part of its analysis, Group-IB notes that antivirus software installed on users’ devices failed to detect any threat during the installation of the malicious software.“This threat is directed at Android OS users - bank customers using SMS banking and those who use mobile banking apps,” the company’s head of malicious code dynamic analysis department Rustam Mirkasymov commented.“Notably, antivirus programs installed on victims’ phones did detect that the accompanying app was dangerous at any stage while the virus was spreading (and continued not to detect anything).”The virus is a further headache for Russian consumers after a widespread attack began collecting Bitcoin ransoms and wiping data earlier this month.",2
Not Exit Scam? Users Freak Out Over Bitcoin Stored on AlphaBay,Joseph Young,2017-07-06 17:00:00,18638,276,"Various sources including Mashable reported earlier today that the dark web marketplace could be pulling out an exit scam with the focus set on stealing user funds and Bitcoin.Rumors emerged that AlphaBay, the world’s largest and most active dark web marketplace, purposely terminated its services and shut down its platform to obtain customer funds and execute an exit scam.After an abrupt termination of AlphaBay servers and marketplace, users expressed their frustrations and concerns over the security of their funds and requested the AlphaBay moderators to provide an official announcement regarding the status of user funds and the platform.Analysts and researchers including Collin Crypto revealed that the AlphaBay moderators responded to the community’s growing criticisms and concerns. In various online communities including Reddit, AlphaBay moderators wrote:“AlphaBay is currently down. We are waiting for updates from AB admins. Don’t panic and don’t post any more threads telling that AlphaBay is down. Don’t get phished or scammed by fake vendors offering you direct deals. Wait patiently until we hear official updates from the staff rather than speculate.”More to that, AlphaBay moderators noted that the AlphaBay platform would be restored soon. The platform went through various server updates and security updates in order to keep customer funds and the entire platform safe.Another AlphaBay moderator wrote:“I have been in touch with our developers and admins and they are working to restore AlphaBay as soon as possible. As I have said before, during downtimes, there are added risks that you should understand and be weary of.”In total, AlphaBay experienced a 27-hour downtime. However, both the community and developers of AlphaBay stated that the recovery of the platform and fixes for security flaws would make the AlphaBay platform more resilient to security issues in the future.As previous Cointelegraph reports emphasized, it is not a viable option to store Bitcoin or any other cryptocurrencies on centralized and custodial platforms. Although users or vendors on AlphaBay could have been storing Bitcoin on the platform in order to execute deals and process payments more efficiently, for security purposes, it is never safe to store Bitcoin on custodial platforms.For instance, the July 5 server downtime of AlphaBay could have locked customer funds for an indefinite amount of time. The moderators of AlphaBay did not immediately provide the community with an official announcement until various Reddit threads emerged, criticizing the platform and raising the possibility of an exit scam being executed by AlphaBay.At the moment, users can be assured that their funds are safe, as said by the moderators of AlphaBay.",5
Bitcoin Mining Boss Bhardwaj Carries On Despite Arrest Petition,William Suberg,2017-07-04 18:06:00,32072,397,"GBMiners creator Amit Bhardwaj has released a book on cryptocurrency for beginners despite allegations he is running a Ponzi scheme.As Indian news resource Factor Daily reports quoting research from CoinJournal and The Caravan, Bhardwaj is currently subject to a Change.org petition calling for his arrest.Today nonetheless a cover of Indian newspaper The Hindu contains a full-page advertisement for his book, ‘Cryptocurrency for Beginners,’ which is available online priced at 1,499 rupees ($23.15).Bhardwaj’s GBMiners currently controls just over three percent of Bitcoin’s network hash rate, while two other projects, Gainbitcoin and AmazeMiners, of which he is CEO, are subject to suspicion.Specifically, participants signing up to Gainbitcoin allegedly receive 100 percent profits with no expenditure necessary, something which under normal conditions makes no logical sense.“He repeatedly contradicted himself, and was evasive about the relationship between GBMiners and Gainbitcoin,” Caravan journalist Aria Thaker meanwhile reported on interviewing Bhardwaj.“He also admitted, with casual ease, that he had lied to his investors about crucial information regarding Gainbitcoin’s investments (‘They feel good, right? When they get high information,’ he told me about his customers, after admitting to using inflated figures on Gainbitcoin’s website).”The petition makes specific reference to AmazeMiners, meanwhile, noting Bhardwaj’s Facebook post about its commission from April contains mostly “comments about payout grievances.”“I request you all to sign this petition asking the Commissioner of Police, Delhi to arrest Mr. Amit Bhardwaj and make him compensate (sic) all those he has scammed,” the petition concludes.",4
Bitcoin Trader From Arizona Charged With Money Laundering Scheme and Illegal Possession of Firearms,Anthony Coggine,2017-06-29 20:40:00,14448,327,"On April 2017 Bitcoin trader Thomas Costanzo was charged for money laundering and running an unlicensed money transmission business.Costanzo was discovered to have been running a Bitcoin trading website that offers Bitcoin mining equipment. Back in April, Costanzo was convicted of illegal possession of firearms as well as marijuana. An investigation and a raid by the Federal Court resulted in the seizing of illegal drugs that he possessed, financial documents, Bitcoin transactions, and gadgets.Costanzo was able to make a good reputation for himself in the Bitcoin market for a year with many customers giving him good reviews. As a trader, he is known as Morpheus with over 100 Bitcoin trading transactions. Court records show another individual Dr. Peter Steinmetz, a Bitcoin proponent, being accused of operating an illegal money laundering business and illegal digital currency exchange, without a license with Costanzo.Dr. Steinmetz pleaded not guilty on those two accounts and was eventually released, Phoenix News Times reports. Releasing a statement on the allegations, Dr. Peter Steinmetz’s legal representative, Brian E. Klein of Baker Marquart,LLP, sent the following to Cointelegraph:          “Dr. Peter Steinmetz is a highly respected scientist and a visionary. He plans to vigorously defend himself against the charges, and he is confident that when all the facts are known, he will be vindicated.”The alleged connection between the two suspects was identified through a Youtube video that Costanzo uploaded featuring Steinmetz explaining what Bitcoin technology is all about. Costanzo was discovered to be in possession of firearms and bullets during a raid of his house by the feds in April 2017. On a different occasion, Dr. Steinmetz, was caught carrying a gun while he was at Sky Harbor’s Terminal Four airport, which he claimed, was for a pro-gun demonstration, ABC15 Arizona reports.The jury trial is set for both of the defendants on August 1, 2017.",2
BitPay Phishing Email Discovered,Jon Buck,2017-06-25 15:25:00,13963,259,"The proliferation of scams in the Bitcoin and cryptocurrency world continues, even as the values show signs of stability. As with other banking institutions, the Bitcoin world is falling prey to phishing scams seeking access to private wallets.The most recent appears to be a phishing email sent under the name of bitpay.org, the payment and settlement service for cryptocurrencies. After a number of users reported the email to the company, one of the leads for BitPay released a public service announcement via Reddit, warning users.The announcement included the following statement indicating that: “This is not a legitimate BitPay email and is a clear phishing attempt. If you receive this email do not open its contents and certainly do not click on any link, button, or attachment.”Users are encouraged to report the attempt to email providers. Gmail users can report by visiting Official Gmail Help Center.As Bitcoin price increases, the opportunity for fraudulent scammers will continue to increase, leading to greater levels of risk for holders.",[]
OneCoin Vietnamese License is Forgery,Jon Buck,2017-06-25 10:05:00,18690,885,"The Vietnamese government has issued a strong statement against the purported Ponzi scheme OneCoin after the company claimed to have been licensed by the government.The company held a supporting event in the country, after claims that Vietnam had given the company official licensed status to function. After the event, the Vietnamese authorities began looking into the company and have since issued the statement detailing the forged license. After some brief investigation, the government stated that the signature on the form didn’t even match the officer of the government institution responsible for the licensure.The Ministry of Planning and Investment (MPI) had begun receiving public inquiries after the company posted a (now deleted) note on its OneLife Vietnam website stating that: “The Hanoi Investment Management Department officially signed a document confirming that the ONECOIN electronic money business of TRIDENT CRYPTO ACADEMY is not contrary to the laws of the Socialist Republic of Vietnam.”The news follows a recent government ultimatum for OneCoin in Norway as well. The OneCoin Ponzi scheme is one in a long line of coin-based frauds including the now defunct Ecoin Plus.",8
"Another Day, Another Scam: Ecoin Plus Disappears With Investors’ Cash",William Suberg,2017-06-19 15:30:00,26371,881,"Alleged Bitcoin investment scheme Ecoin Plus has disappeared and closed its website, leaving investors with nothing.Known variously as Ecoin Plus and empowercoin.com, the tool touted annual returns on submitted Bitcoin investments which increased according to how many coins were contributed.No information is available from developers, with the project keeping a low profile throughout its existence.“It would seem that Ecoin Plus doesn't want anyone to know who they are or what is really going on behind the scenes of this Bitcoin community,” a quasi ""review"" on news resource Players Money states.In a manner similar to assumed Ponzi scheme OneCoin, Ecoin Plus offered so-called “packages” with differing rates of return.No product or service was available, and no proof of funds handling or security was made public.“It would seem that Ecoin Plus is the way to go to make money from Bitcoin. After all, the site states that they mine the Bitcoins so that you win in the long run,” Players Money continues, adding that it found “major red flags” while assessing the now-defunct website.As recently as a week ago, however, Ecoin Plus was uploading promotional material in which various “users” reported receiving thousands of dollars in dividends.Cointelegraph reminds readers to always thoroughly research purported investment opportunities prior to sending any funds. If it sounds too good to be true, in cryptocurrency, it is!",4
Two US Army Guardsmen Charged and Convicted for Bitcoin Fraud,Anthony Coggine,2017-06-12 22:54:00,17591,350,"On May 23, 2016, two members of the US Army National Guard were convicted of running an intricate credit card scheme through the means of Bitcoins. Other three Guardsmen – Derrick Shelton, Quentin Stewart, and Jamal Moody – pleaded guilty for wire fraud, aggravated identity theft, and conspiracy to commit access device fraud.On June 2, the two indicted persons, James Stewart and Vincent Grant, were caught red-handed using Bitcoins in purchasing stolen credit and debit card numbers. They bought the credit cards from a number of foreign websites. The Justice Department records reveal that Stewart and Grant were also prosecuted last year.The perpetrators successfully skimmed credit card information by using advanced magnetic strip tools. The numbers were then transferred to dummy cards which were used to purchase merchandise from Army and Air Force Exchange Service stores stationed at various US military bases. Apparently, the duo also bought items from other locations all over Maryland.Stewart was found guilty on charges of wire fraud, conspiracy to commit wire fraud, and aggravated identity theft. Grant, on the other hand, was convicted for conspiracy to commit access device fraud and also aggravated identity theft. Overall, five members of the US Army National Guard were arrested and charged.James, Shelton, and Quentin will face a maximum of 20 years imprisonment, while Grant and Moody are heading on to a maximum of seven-and-half year sentence. All of the five suspects involved will also face a mandatory imprisonment of two years minimum for aggravated identity theft.Even though Bitcoin is known as a dynamic cryptocurrency, key lapses in its blockchain data enabled the frauds committed by the indicted Guardsmen. With the prevalence of such crime, many experts are certain that blockchain platforms will have stricter, anti-fraud systems. Since many ‘Bitcoin frauds’ are still operational, heightened vigilance is needed by Bitcoin owners whenever doing transactions online.",2
GAW Miners Creator Josh Garza Fined $12 mln For “Ponzi Scheme”,William Suberg,2017-06-06 13:50:00,9334,211,"Former GAW Miners creator Josh Garza faces a $12 mln fine for running what lawmakers have certified was a “Ponzi scheme.”Garza, who was charged with securities fraud in 2015 and is also facing separate criminal proceedings for running the fraudulent mining operation, received a final judgment from the US Securities and Exchange Commission (SEC) on June 2.“According to the SEC's complaint, GAW Miners and ZenMiner did not own enough computing power for the mining they promised to conduct, so most investors paid for a share of computing power that never existed,” the official filing reads.“Returns allegedly paid to some investors came from proceeds generated from sales to other investors.”GAW Miners and sister scheme Paycoin attracted widespread accusations while it was active during 2014, despite Garza’s persistent efforts to denounce what he considered defamatory propaganda on the part of users, commentators and the media.A ruling is yet to be made on what should happen to the Bitcoin funds collected by Garza and his associates, with the virtual currency’s price having markedly increased in the intervening period.The penalty specifically takes the form of “$10,384,099 in disgorgement and prejudgment interest. The final judgment also requires each entity to pay a civil penalty of $1,000,000.”",2
Ponzi Alert: New Zealand Lawyer Labels “We Grow Bitcoins” Simple Scam,William Suberg,2017-06-01 15:25:00,13349,286,"A New Zealand lawyer has called suspected pyramid scheme We Grow Bitcoins a “simple scam” after a news investigation.In an article by local platform Newshub, consumer law specialist Prajna Moodley concluded that investors funneling money into the scheme, which promises 62 BTC ($148,300) monthly returns, would never see their cash again.“I would go as so far as to say it's a simple scam, from what I can work this involves people investing money and never hearing from the company again,"" she told the publication.The investigation focuses on the story of a New Zealand investor by the name of Daniel Tepania, who sent the so-called “crowdfunding community” the required NZ$30 minimum entry fee and is awaiting payouts.""It's only been here about a month so I thought I would give it a go, sounded quite good,"" he told Newshub.New Zealand’s Commerce Commission pointed journalists to its legislation on pyramid schemes when approached about We Grow Bitcoins, such schemes being illegal under local law.“WeGrowBitcoins is a member to member donation platform,” the website states.“Members pay a monthly subscription to have access to the platform. Platform access allows members to receive donations directly into their bitcoin wallet from other members.”Cointelegraph would like to remind readers that investing in projects purporting to deliver unproven profits in return for direct payment should be avoided.",[]
"WannaCry Not First NSA-Enabled Cyberattack, Hackers Made Computers Mine Monero",William Suberg,2017-05-17 14:25:00,14471,272,"The NSA-enabled Windows loophole used in WannaCry previously made computers mine Monero (XMR) in a separate attack.According to research reported by Ars Technica, hackers were able to exploit the vulnerability in unpatched Windows operating systems for financial gain as early as April 24.Using mining software called Adylkuzz, the same weaknesses meant attackers were “surprisingly effective at compromising Internet-connected computers,” according to Proofpoint researcher Kafeine.Not only that, but WannaCry may have in fact slowed down due to the pre-existing exploit.Kafeine wrote in a Proofpoint blog post:“Initial statistics suggest that this attack may be larger in scale than WannaCry, affecting hundreds of thousands of PCs and servers worldwide.”“...Because this attack shuts down SMB networking to prevent further infections with other malware (including the WannaCry worm) via that same vulnerability, it may have in fact limited the spread of last week’s WannaCry infection.”The effects of WannaCry are still ongoing as ransom money slowly trickles through to perpetrators.The post confirms that otal yield from the Adylkuzz scheme appears to be around $43,000 distributed among three XMR wallets.“Two major campaigns have now employed the attack tools and vulnerability. We expect others will follow and recommend that organizations and individuals patch their machines as soon as possible.”",[]
"With Scammers Capitalizing On Altcoins Surge, How to Spot New Ponzi Schemes?",Iyke Aru,2017-05-17 12:50:00,23360,591,"The activities of scammers within the cryptocurrency industry is on the increase. It is suggested that the increased popularity of Bitcoin and other altcoins such as Ripple, Ethereum and Litecoin may have stirred up some genuine curiosity in the faculties of newbies and other hopefuls around the crypto ecosystem. It is this growing curiosity that is milked by con artists who take advantage of the ignorance of their victims.When it comes to disruptive technology, knowledge isn’t just power, knowledge is everything.The right knowledge about any given innovation will always offer genuine and sustainable benefits. On the contrary, a distorted idea of any given technology will not only be misleading, but it remains a metaphorical time bomb that will eventually explode when the time comes.""In as much as Blockchain and the Distributed Ledger Technology (DLT) offers a huge platform for various kinds of innovations and investments, the promise of unrealistic returns on investment is a common characteristic that cuts across almost all cryptocurrency scams.""Hiding behind the veil of crypto related activities, a lot of Ponzi schemes have succeeded in enticing many unsuspecting participants.One common characteristic of these setups is their ambiguous way of explaining their processes. They always flinch when confronted with direct questions and the quest for appropriate details of their investment schemes.The basic life-cycle of every pyramid scheme is dependent on its ability to keep recruiting new members.In other words, pyramid schemes can be regarded as Ponzis, where the investments of new recruits are used to pay existing participants.Therefore, as soon as the rate of recruitment falls below a certain level, the system becomes unsustainable and a lot of people will end up losing their investment.Bob Wood, CEO at Nexxus Partners, tells Cointelegraph that cryptocurrency scams abound from the perfect storm of a major disruptive technology and the uninformed public. Wood explains how the average non-technical person can identify these scams early on. Look at:Who are the people behind the cryptocurrency? Are they trustworthy and competent? Are their names and resumes published for the public to review? Do they have a Google trail of promoting other scams? Do they have an experienced technology team behind the cryptocurrency? These are some of the questions that should be clarified by an investor towards any given prospective venture.For entities that are out to promote a given cryptocurrency, questions should be asked about how they are creating value with their cryptocurrency? Are they providing retail products or services as a value to the marketplace to generate a profit? Why would anyone buy and use their cryptocurrency? What user benefit will be derived, outside of speculative trading?Every investor should be wary of claims of receiving an unusually high and fast return on investment. Some scams claim 1-2 percent of daily earnings or 100 percent monthly earnings. Obviously, too-good-to-be-true, but it hypnotizes the greedy into irrational thinking. The reality is that all or most of the returns on investment are being paid from new investors money (i.e. Ponzi scheme), that always collapse eventually.Acclaimed methods for creating profits must be properly scrutinized. Profits from mining Bitcoins is a common claim that is fallacious due to the very competitive mining environment. Another claim is arbitrage, which is the ability to buy low on one public exchange and sell high on another. There is nowhere near the volume of opportunity to satisfy the promised profits. Finally, be wary of claims of widespread acceptance by merchants. When merchants accept a coin they typically have to sell the coin to pay their bills, which drops the coin price not increase it.Wood concludes by noting that the best way for people to protect themselves from cryptocurrency scams is to invest in education to become knowledgeable about the potential and virtues of cryptocurrency.",3
OneCoin Controversy Intensifies As Attorney of Threatened Critic Asks New Questions,Iyke Aru,2017-05-15 15:23:00,18477,214,"Bjorn Bjercke, one of OneCoin’s major critics, responds through an attorney in regard to the company’s lawyers who demanded of him to be silent.Bjercke is a Norwegian Blockchain professional who was recently threatened by the organization.He told Cointelegraph of his resolve not to allow any form of bullying or intimidation to hinder his advocacy in ridding the Blockchain community of what he describes as a “cancer to the cryptocurrency community”.In a letter of response, Bjercke’s attorney notes that the activities of his client is protected by the constitutional freedom of expression. He insists that his claims remain legitimate and are based on critical circumstances related to the business that OneCoin Ltd conducts.While maintaining that Bjercke’s legitimate actions cannot cause OneCoin any financial or further reputational loss of any kind, Bjerke’s legal response seeks answers from OneCoin. The following questions were asked:Where is the company OneCoin Ltd registered?Who is the company’s board?Who are the company’s directors?What is the company’s address?What is the company’s organization number?The letter comes amidst several events that has seen some key players and partners of OneCoin appear to be self-contradicting in their communications.A classic case is that of the CEO of DX Markets, Marcelo Garcia Casil who made public a letter refuting statements that questions the existing technological capabilities supporting OneCoin attributed to him.In his letter, Casil says:“I refute any allegations that I had not seen the existing system nor have I questioned the competence of OneCoin’s existing arrangements to satisfy the current needs of the cryptocurrency.”However, shortly after Casil’s letter was made public there appeared a screenshot of a Twitter conversation where he was seen to have earlier retained and opinion that contradicts his position as contained in his letter.Developing events suggest that we are yet to see the end of the battles of OneCoin as the triangle of hosts, investors and opponents continue in their respective struggle for interest, hope and salvation for the people.",9
