title,author,dt,views,shares,abody,comments
"Bulgarian Police Raids OneCoin Offices, ‘Ponzi Scheme’ Servers Shut Down",Molly Jane Zuckerman,2018-01-22 12:34:00,65315,930,"OneCoin offices were raided and its servers seized in Sofia, Bulgaria, on Jan. 17 and 18, as yet another step in a series of international raids and court cases against the highly-controversial altcoin. Although the servers were shut down, OneCoin currently remains operational.The raid took place at the request of the prosecutor’s office in Bielefeld, Germany, and was carried out by representatives of the Bulgarian law enforcement as well as European Union crime fighting units. OneCoin’s founder, Ruja Ignatova, is Bulgarian-born but has German citizenship.OneCoin, which promotes itself as a “centralized model [that] protects its members' safety and ensures compliance on AML [anti-money laundering],” does not fit the definition of a cryptocurrency, for it is not decentralized, does not run on open-source software, and does not have a public ledger.The documents and servers were seized from “One Network Services” EOOD, a Bulgarian company serving as a representative and distributor of OneCoin, as well as 14 other companies. 50 witnesses were questioned during the raid, but no arrests have yet been made.The company is registered officially in the United Arab Emirates as “OneCoin Ltd.,” but according to the Bulgarian police report, the company operates through“Hundreds of affiliated companies on 4 continents [...] [which] are being investigated in England, Ireland, Italy, the United States, Canada, Ukraine, Lithuania, Latvia, Estonia and many other countries.”A OneCoin representative faced charges of fraud in Kazakhstan in May 2017, and in India, police had arrested 23 people in connection with OneCoin’s pyramid scheme by July 2017.More recently, in August 2017, the Italian Antitrust and Consumer Protection Authority (AGCM) branded OneCoin a Ponzi scheme and fined them 2.5 mln euros, the first financial fine on the company.Cointelegraph has previously denounced OneCoin as a Ponzi scheme, warning readers to stay away from the coin.",12
Bitconnect Ponzi Scheme - No Sympathy From Crypto Community,Gareth Jenkinson,2018-01-19 18:40:00,200670,671,"What looked too good to be true ended up being just that, as Bitconnect has all but closed its doors.Long accused of being a Ponzi-scheme, Bitconnect shut down its cryptocurrency exchange and lending service this week. As stated on their website, Bitconnect had received cease and desist letters from two American securities regulators - leading to the closure of their lending and exchange platforms. Still, Bitconnect will continue to run its website and wallet service.Since its inception in January 2017, many were skeptical about Bitconnect services. In essence, one needed to send Bitconnect Bitcoin in exchange for Bitconnect Coin (BCC) on their exchange.Once you had BCC, you were guaranteed “up to 120 percent return per year.” Users were told they were earning interest by holding their coin “for helping maintain the security of the network.”Source: Bitconnect.coBitconnect’s lending platform is what really led to accusations of a Ponzi scheme, as well as cease and desist orders from regulators.Source: Bitconnect.coAs the above illustration explains, users bought BCC with Bitcoin and then lent out their BCC on the Bitconnect lending software.Users would receive varying percentages of interest depending on the amount of BCC they had lent.Source: Bitconnect.coAdd in the referral system seen in many other Ponzi schemes and the fact that the operation was run anonymously; it's hardly surprising that this whole endeavor has ended in tears.The lending scheme was the main draw card of Bitconnect because of its huge promise of returns. In order to participate in the scheme, you had to buy BCC - which saw the token hit an all-time high of $437.31 per BCC before it plummeted in value following the closure this week.That being said, the cryptocurrency is still alive and trading at around $35 at the time of writing.Following Bitconnect’s closure, social media was abuzz with sentiments of ‘I told you so.’TenX co-founder Julian Hosp highlighted the fact that BCC was still trading as a real head-scratcher.Everything that's wrong with crypto in one picture! #bitconnect #scam #ponzi #cryptocurrencies #bubble pic.twitter.com/t5o9Nm1rZ4Francis Pouliot shared a hilarious video of a Bitconnect meet which had been slightly dubbed over.People invested billions of dollars in this(This video is actually hilarious recommended for memephiles) https://t.co/Jpb8xpJsx7American cartoonist Spike Trotman shared one of the most entertaining and eerily accurate predictions back in September 2017, postulating that Bitconnect was indeed a Ponzi scheme.Her latest tweet is a screenshot of the Bitconnect Reddit page, with subreddits for a suicide hotline as well as a massive legal action megathread. Do yourself a favor and take a look at Iron Spike’s full threat on Bitconnect - it’s brilliant.The current state of the Bitconnect subreddit is truly a thing to behold. https://t.co/QoGgUiE0XMRodolfo Novak shared a photo of the monumental collapse in price of Bitconnect from Coinmarketcap, highlight the moment the Ponzi scheme hits ‘exit time.’This is what a real ponzi looks like at the scam exit time. #BitConnect #BCC pic.twitter.com/2oAlaDMJtZ",96
Russia: Blogger Who ‘Boasted’ About Crypto Wealth Beaten and Robbed For $425k,William Suberg,2018-01-15 22:35:00,91466,517,"A Russian cryptocurrency investor and blogger known online as Pavel Nyashin was attacked and robbed in his home in Leningrad Oblast the night of Jan. 14. The assailants stole funds worth 24 mln rubles ($425,000), according to local media.Nyashin was tied and beaten while a group of masked assailants stole a safe containing cash and “essential documents.”Nyashin, a self-made millionaire from cryptocurrency investing, had “boasted” about his wealth online and at meetings of well-known bloggers he attended, local media network NTV reports.The crypto blogger told NTV in a video interview:“They took the safe in the end, as they knew there was cash in the house. In it was a sum equivalent to 24 mln rubles, as well as a lot of essential documents.”The 23-year-old Nyashin from St. Petersburg had previously made known about his successes online while advising on how to become rich from cryptocurrency, according to NTV, which ran an admonitory headline “Millionaire blogger beaten and robbed for boasting.” According to Russian-language cryptocurrency news outlet ForkLog, Nyashin is the founder of the YouTube channel on crypto trading that has almost 15,000 subscribers.ForkLog also reported that the “bandits” destroyed all electronic equipment in Nyashin’s home and fled the scene in what appeared to be a Mercedes.NTV adds that the assailants further removed a laptop he used to trade on exchanges. Nyashin himself has yet to find out if his accounts have been hacked and assess the full damage done.A criminal case has been opened on the armed assault, NTV reports.Cointelegraph previously reported on the fate of EXMO exchange CEO Pavel Lerner, who was kidnapped in the Ukrainian capital Kiev and only released on payment of a $1 mln ransom late last month.Prior to that, Ukrainian security personnel allegedly tried to steal funds from Anatoly Kaplan, founder and CEO of ForkLog, in a raid of his place of residence, as well as of the ForkLog office, in Odessa.",17
"Hardware Bitcoin Wallets Not Vulnerable to Spectre Attacks, Funds Safe",Joseph Young,2018-01-05 02:55:00,68680,529,"Trezor and Ledger, two of the most widely utilized cryptocurrency hardware wallets, have reaffirmed that the recently discovered vulnerabilities on CPUs and the latest Spectre attacks have not affected hardware cryptocurrency wallets.As Cointelegraph previously reported, Pavol Rusnak, the chief technical officer at Satoshi Labs, the parent company of Trezor, wrote:“As more people are asking: @TREZOR is not vulnerable to recent Meltdown and Spectre hardware attacks, because it has processor not affected by these. Also our firmware is always signed, so the device never runs untrusted code. Using a hardware wallet is now more important than ever.”Rusnak emphasized that users should rely on hardware wallets at this specific period of time, because Spectre attacks have drastically impacted the cloud services on which many cryptocurrency exchanges and wallet platforms operate. Earlier today, several cryptocurrency exchanges including Bittrex were taken offline due to the vulnerabilities found in Intel CPUs. These weaknesses affected Azure cloud services offered by Microsoft, and by extension, the exchanges hosted on Azure.New York Times cybersecurity journalist Nicole Perlroth wrote:“Meltdown and Spectre show that it is possible for attackers to exploit these design flaws to access the entire memory contents of a machine. The most visceral attack scenario is an attacker who rents 5 minutes of time from an Amazon or Google or Microsoft cloud server and steals data from other customers renting space on that same cloud server.”Hardware cryptocurrency wallet developers and Bitcoin experts have recommended users to move their funds from centralized online platforms to hardware wallets. Jonas Schnelli, a Bitcoin Core developer, stated:“The current privileged memory side channel attacks just confirms what many Bitcoin users already know. Don't trust your PC. Don't think applications (and private keys) are shielded. Use a hardware wallet.”Unlike exchanges, hardware wallets are non-custodial wallets that allow users to remain in full control over their private keys. When users initialize their hardware wallet, they write down 12 - 24 words which comprise a backup for their seed. With this backup, even if the wallet platform gets hacked, users can obtain their funds and move them to another wallet or paper wallets.But centralized trading platforms and wallets store private keys on behalf of their users. The result is a centralization of private keys, creating a significant security issue.The Ledger development team released a detailed blog post as to why hardware cryptocurrency wallets are not at risk due to Intel, AMD and ARM CPU vulnerabilities. The company wrote:“Ledger’s devices are not affected by these attacks. First of all, to exploit these flaws, the attacker has to be able to run arbitrary code. As long as you only use Ledger’s embedded apps (which is strongly recommended), your Nano S / Blue is not vulnerable to these kind of attacks.”Most importantly, because any modern machine is affected by the Spectre vulnerabilities, it would be wise not to use Wi-Fi while sending and receiving cryptocurrencies.",5
"Two New Hardware Bugs Affect Most Devices, Private Keys Vulnerable",William Suberg,2018-01-04 20:40:00,67930,522,"Researchers have published a report on two hardware bugs that allow programs to steal sensitive data on affected devices, which is “most” devices worldwide.For crypto users, these bugs are a direct threat to the security of their private keys, making the need for secure hardware storage of crypto funds even more pressing.The two bugs, known as Meltdown and Spectre, exploit security vulnerabilities in Intel, AMD, and ARM processors in any device, including PCs, laptops, tablets, and smartphones.Meltdown affects all devices with Intel chips, which are estimated to be in 90% of all computers (desktop and laptop combined), the BBC reported.Spectre potentially has an even wider reach, affecting Intel, ARM, and AMD chips in any kind of device. Meltdown and Spectre also work in the cloud.The BBC also reported that the tech industry kept the threat a secret for up to six months via non-disclosure agreements, but now fears are mounting that public awareness could lead to real-life exploits.Bitcoin core developer Jonas Schnelli referred to the newly reported security flaws in terms of how they affect Bitcoin users, laying out three steps to secure cryptocurrency holdings:The current privileged memory side channel attacks just confirms what many Bitcoin users already ""know"" (feel):* Don't trust your PC.* Don't think applications (and private keys) are shielded* Use a hardware walletBackground:https://t.co/0avUWC44oyhttps://t.co/pw0cLDWyZePavol Rusnak, the CTO of TREZOR manufacturer SatoshiLabs, tweeted Jan. 4 to confirm that its devices are unaffected by Meltdown and Spectre, noting:“Using a (hardware) wallet is now more important than ever.”As more people are asking: @TREZOR is not vulnerable to recent Meltdown and Spectre hardware attacks, because it has processor not affected by these. Also our firmware is always signed, so the device never runs untrusted code. Using a hw wallet is now more important than ever!In October 2017, the Ledger Nano S hardware wallet was number eight in the list of top ten best selling items on Amazon’s Computers and Accessories section. Today, Jan.4, the Ledger Nano S is number one.",16
FT: EXMO Director Released From Kidnap After Paying $1 Mln Ransom,Olivia Capozzalo,2017-12-29 22:00:00,42867,271,"Pavel Lerner, the managing director of the cryptocurrency exchange EXMO kidnapped in Kiev Dec. 27, was released today after paying a $1 mln ransom in Bitcoin, The Financial Times (FT) reports.Lerner was abducted in Kiev on Wednesday leaving his office. Ukrainian online publication Strana.ua was first to report that he was taken away by “unknown persons” in a black Mercedes Benz.FT reports they were informed of the ransom payment by Anton Gerashchenko, an adviser to the Ukrainian interior minister. Gerashchenko told FT:“He was kidnapped by an armed gang for the purpose of extorting Bitcoins. We have operative information that he paid more than $1 mln worth of Bitcoins.”In an article published today, Strana.ua reported that sources in the local police believe the kidnappers were frightened into releasing Lerner after the story of his abduction garnered so much attention globally.Today EXMO released an official statement about Lerner’s abduction. The statement reports that the company “got a hold” of Lerner today and that he is currently safe:“At the moment, he is safe, and there was no physical harm inflicted on him. Nevertheless, Pavel is currently in a state of major stress; therefore, he will not provide any official comments in the coming days.”The EXMO statement contains no mention of a ransom paid of any amount. In the statement, the exchange repeated that Lerner’s abduction in no way affected the company’s usual functioning:“We would also like to point out that Pavel’s activity at EXMO did not involve an access to financial assets of our users. Despite the aforementioned, the platform continues its usual operations.”However, according to the company’s official Twitter, the exchange was under DDoS attack just yesterday, Dec. 28.EXMO is under the DDoS attack.The site will be available within half an hour.We apologize for the temporary inconvenience.Sincerely, The EXMO TeamAccording to Strana.ua, Lerner is a Russian citizen who holds a residence permit in Poland and is involved in a number of crypto/ Blockchain startups in Ukraine. FT reports that EXMO is officially registered in the UK, but has “operations in Ukraine.”As per EXMO’s official statement today, the investigation into Lerner’s abduction continues and the identities of the kidnappers are still unknown. Once identified, the perpetrators could face up to five years imprisonment, in accordance with article 146.2 of the Ukrainian criminal code, which covers abduction for “mercenary purposes” or by a group of people “upon their prior conspiracy.”",2
"South Korean Government Concerned With Scams in Bitcoin Market, Fake Exchanges",Joseph Young,2017-12-25 18:27:00,38426,309,"The South Korean government and local financial authorities have warned investors about the emergence of fake cryptocurrency and Bitcoin exchanges.On Dec. 13, the South Korean government and its cryptocurrency task force formed by the Ministry of Strategy and Finance, Financial Services Commission, Ministry of Justice, Fair Trade Commission and Financial Supervisory Commission held an emergency meeting to discuss the state of the South Korean cryptocurrency market and draft regulations for both businesses and investors.Two of the four regulations drafted by the South Korean government during the emergency meeting were:Given the rapidly increasing number of fraudulent cryptocurrency exchanges, platforms and activities, the South Korean government urgently moved to regulating cryptocurrency exchanges and cracking down on fraudulent operations.Last week, several fake cryptocurrency exchanges were exposed by the local Bitcoin community and financial authorities. One of the fake exchanges was BitKRX, named after Korea Exchange (KRX), the largest financial trading platform in South Korea established by KOSDAQ, South Korea Futures Exchange and South Korea Stock Exchange.The BitKRX exchange marketed itself as a branch of KRX, coaxing users into its platform by promoting its businesses as a regulated and legitimate venture led created by KRX.Chosun, one of South Korea’s largest mainstream media outlets, reported that local financial authorities and law enforcement have begun to crackdown on cryptocurrency exchanges with deceptive marketing and fraudulent operations. Specifically, local financial authorities disclosed that several cryptocurrency exchanges in South Korea are unregulated but are operating as legitimate businesses by utilizing the branding of leading financial institutions, like BitKRX.One member of the South Korean Bitcoin community told Chosun:“A small group of individuals that are not qualified and experienced enough to run high-traffic and large-scale platforms are running cryptocurrency exchanges in the local market. Consequently, traders are not able to properly execute buy and sell orders in a timely manner, causing major losses and difficulties for investors. Strict regulation of the market by the South Korean market will further stabilize the local cryptocurrency market.”Earlier this week, South Korea’s largest cryptocurrency exchange Bithumb, which is also the second largest trading platform in the global cryptocurrency market, stated that a right set of regulations for businesses and investors would nurture the cryptocurrency market and facilitate its exponential growth. Bithumb said:”A right set of regulations will rather nurture the (virtual currency) market, and we would welcome that.”For cryptocurrency exchanges like Bithumb, Korbit and Coinone, that process billions of dollars in trades on a daily basis, regulations are necessary because a rather large portion of investors in the South Korean cryptocurrency market are falling victim to Ponzi schemes and scams.This month, a $200 mln cryptocurrency-inspired Ponzi scheme was unraveled by the local law enforcement. 14 individuals of MiningMax, a cloud mining Ponzi scheme, were arrested by South Korean police with several charges, including economic crime and fraud.According to cryptocurrency market data provider CryptoCompare, the South Korean cryptocurrency exchange market only accounts for 4.6 percent of the global cryptocurrency exchange market, behind the US, Japan and Europe.A $200 mln Ponzi scheme in a relatively small market can be avoided if investors directly trade cryptocurrencies on regulated platforms and exchanges.",8
North Korea Accused of Hacking South Korean Bitcoin Exchange Youbit,Joseph Young,2017-12-21 23:15:00,44575,331,"Earlier this week, major South Korean Bitcoin exchange Youbit suffered a large-scale security breach that led to the theft of one fifth of user funds.Almost immediately after the hacking attack, Youbit’s parent company Yapian filed for bankruptcy. In an official statement, the Youbit team told its users that 75 percent of their holdings on the Youbit exchange will be accessible and ready for withdrawal. But, to claim the rest of the funds, the company stated that investors will have to wait until the final settlement of bankruptcy proceedings.In the case of the now-defunct Bitcoin exchange Mt. Gox, which once was the largest Bitcoin exchange within the global cryptocurrency market, the settlement of bankrupt proceedings have taken more than four years. Still, the creditors of Mt. Gox have not received their funds and the procedure is still ongoing.Unfortunately, for Youbit investors, it may take several months to years to receive the remaining 25 percent of their personal funds, as the settlement of bankruptcy proceedings will have to be finalized before the company can credit its customers.Upon the discovery of the hacking attack, the Youbit team told its clients that the company is working closely with local authorities and the South Korean law enforcement to evaluate and investigate the security breach. The Youbit team said:“Currently, we are cooperating with law enforcement and third-party investigators to evaluate the breach. We are trying everything in our capability to minimize the losses of our users and we are considering several ways to handle this situation. We would like to apologize again for disappointing our users.”According to the Wall Street Journal, sources familiar with the ongoing investigation into the Youbit security breach have discovered telltale signs and historical evidence that North Korean state-funded hackers likely engaged and initiated the hacking attack.In September 2017, security research firm FireEye revealed in a threat research paper that it has found evidence to link various cryptocurrency exchange hacking attacks to North Korea by analyzing the tools that were used to hack into South Korean cryptocurrency platforms.One of the methods used by the North Korean hacking group was Spear Phishing, the FireEye report stated, which targeted individual cryptocurrency users with highly sophisticated phishing attacks and malware. FireEye further emphasized that there is some evidence to link previous South Korean cryptocurrency exchange security breaches to North Korea.Specifically, the FireEye team wrote that the following activities were likely initiated by North Korean hackers:Given the imposition of harsh international sanctions against North Korea by the US government and the financial instability of the North Korean regime, FireEye researchers wrote that North Korean hackers have had many incentives to target South Korean exchanges. The report read:“While Bitcoin and cryptocurrency exchanges may seem like odd targets for nation-state actors interested in funding state coffers, some of the other illicit endeavors North Korea pursues further demonstrate an interest in conducting financial crime on the regime’s behalf. North Korea's Office 39 is involved in activities such as gold smuggling, counterfeiting foreign currency, and even operating restaurants.”In an interview with The Wall Street Journal, Troy Stangarone, a senior director at the Korea Economic Institute, shared a similar sentiment with FireEye and stated that North Korea is in an ideal position to target Bitcoin companies as it has to find ways to earn back money from the recently imposed sanctions. Stangarone said:“North Korea is an ideal country to use hacking and financial tools like Bitcoin. They’re experimenting with ways to earn back lost money from sanctions.”Throughout the upcoming weeks, the South Korean law enforcement and cybersecurity agencies are expected to focus on finding solid evidence to link the hacking attack targeted at Youbit to North Korean hackers.",6
"South Korea: Five Local Bitcoin Exchanges Fail Security Test, Hacked With ‘Basic Tools’",William Suberg,2017-12-21 21:05:00,39750,387,"South Korean media outlet MBC has hired a security firm to test the security setup of “five Korean Bitcoin exchanges,” including Bithumb. The company has allegedly been able to successfully hack into all five of the targeted platforms, receiving access to user data and funds.As the network reports in an article, it published about its own exploits today, ‘hackers’ it hired circumvented security procedures using what it describes as “basic hacking tools.”If true, the test underlines the fragmented nature of many users’ cryptocurrency exchange security settings, as well as the setups of exchanges themselves, as larger thefts continue to occur.Just this week, South Korean exchange Youbit announced it was filing for bankruptcy after suffering two hacks this year, the second of which lost it 17 percent of its net assets.It is unknown whether Youbit was one of the five exchanges targeted in MBC’s experiment, which saw security workers set up their own accounts which they then compromised. However, it is claimed that the country’s biggest exchange - Bithumb - was successfully hacked during the test.Bithumb has itself fallen victim to major security breaches in recent months, malicious parties gaining access to both funds and sensitive user account data.As part of the hacking, MBC’s proxies gained “user IDs and passwords” and even circumvented two-factor authentication.“The wallet was penetrated without difficulty,” the article relates. “The key to your wallet, ID and password was exposed.”Various theories have surfaced regarding South Korea’s exchange hacking issues, with North Korea increasingly suspected as a major perpetrator of cybercrime in order to amass cryptocurrency.According to the report, MBC has “contacted the South Korean government” prior to publishing, to notify it about the critical security issues on the local exchanges. Official responses have yet to emerge about the MBC investigation.",5
