title,author,dt,views,shares,abody,comments
"US Prosecutors Seize $17 Mln in BTC, Seek 4,000 BTC More for Dark Web Dealings",Marie Huillet,2018-06-28 12:02:32,15034,252,"U.S. law enforcement has seized $17 mln in Bitcoin (BTC) and other cryptocurrencies, and is seeking to seize about $24 mln more, from two Maryland, USA men, on charges of selling counterfeit drugs on the dark web, according to a Department of Justice (DoJ) press release published yesterday, June 26.In addition to around $17 million in Bitcoin and other cryptocurrencies, Law enforcement has seized $2.5 million in computer equipment, and over $1.5 million in cash. The government is further seeking to forfeit “no less than” $5.67 million, plus the value of 4,000 BTC (about $24 mln at press time), believed to be the proceeds of the illegal drug sales.The six-count indictment –– unsealed June 22 –– alleges that from Nov. 2013 through June 2017, Ryan Farace, 34, sold fake “Xanax” pills on the dark web in exchange for Bitcoin. Together with Robert Swain, also 34, he is further charged with laundering the proceeds through means “designed to conceal the source and ownership of the illegal funds.”Farace now faces a maximum sentence of five years in prison on drug distribution counts, with both men facing a maximum of 20 years’ imprisonment on money laundering charges. In February, a two-year study of the dark web ecosystem claimed that Bitcoin may be losing its cachet as the number one currency on darknet markets, seemingly due to users’ frustrations with network traffic and transaction fees.In March, Cointelegraph reported on a case in Ohio, in which federal prosecutors sought the forfeiture of over 500 Bitcoin (then worth about about $5.5 mln, now worth about $3 mln) seized during the investigation of a group allegedly producing fake identity documents. The US Marshals Service has periodically held auctions for seized crypto assets, selling 3,813 bitcoins (about $22.8 mln today) in January of this year.",4
Ukraine: Four Arrested for Running Fake Crypto Exchanges,Ana Alexandre,2018-06-25 11:00:03,22490,211,"Ukrainian police have arrested a group of four men suspected of running six fake cryptocurrency exchanges, Bleeping Computer reported June 21.Four men between ages 20 and 26 allegedly launched at least six digital currency exchanges, where they deceived users, subsequently stealing money from them. The alleged culprits lured users by promoting the exchanges with fake positive ratings and online reviews. The police reportedly said that the suspects had ""special knowledge and skills in the field of programming"" and ""have created their own CMS-system for managing the content of exchange sites.""During the raid of the suspects’ homes, the police reportedly seized computers, flash drives, smartphones, and other devices. According to a spokesperson for the Ukrainian National Police, “the list of sites is not complete.” Now authorities are asking users to provide information about whether they were deceived by fraudulent exchanges before.Yesterday, the U.S. Securities and Exchange Commission received an additional emergency court order to freeze the assets of Dominic Lacroix, owner of PlexCorps. Lacroix and his partner, Sabrina Paradis-Royer, were accused of violating securities law in respect to the PlexCoin initial coin offering (ICO) conducted by PlexCorps in August last year. The ICO reportedly raised $15 million from “thousands of investors.”Earlier this month, Cointelegraph reported that a Bitcoin trader in Los Angeles, California, was facing prosecution for allegedly running an unregistered multimillion dollar Bitcoin-fiat money transmitting business. Accused Theresa Tetley, 50, reportedly earned at least $300,000 annually from her black market business, which ran between 2014 and 2017 via a listing on localbitcoins.com.",[]
US: SEC Obtains Emergency Court Order to Freeze Assets of Fraudulent ICO,Ana Alexandre,2018-06-21 10:40:32,13432,216,"The U.S. Securities and Exchange Commission (SEC) has received an additional emergency court order to freeze the assets of Dominic Lacroix, owner of PlexCorps, in an ongoing enforcement action, Crowdfund Insider reported June 20. The SEC had previously sued Lacroix for securities fraud and received an emergency asset freeze order in December, 2017. The order was unsealed June 18.The SEC alleges that, since December, Lacroix has been using secret accounts, including an account in his brother’s name which he controlled, to dissipate assets obtained from investors with the PlexCoin ICO. The SEC is looking to collect interest, penalties, as well as permanent injunctions, as well as an officer-and-director bar and a bar from offering digital securities.The SEC’s initial complaint charged Lacroix and his partner, Sabrina Paradis-Royer, with violating securities law in respect to the PlexCoin initial coin offering (ICO) conducted by PlexCorps in August last year.According to the SEC, PlexCorps promised investors a 1,354 percent return in just 29 days. The ICO reportedly raised $15 million from “thousands of investors.” The SEC described Lacroix as a “recidivist Quebec securities law violator.”Last month, the SEC obtained a courter order to halt the activities of Titanium Blockchain Infrastructure Services Inc.’s ICO that raised $21 million from investors in the U.S. and Canada. The complaint from the SEC alleged that the company president lied about business relationships with the Federal Reserve and dozens of well known firms such as Boeing, Verizon, PayPal, and Walt Disney.The three co-founders of cryptocurrency startup Centra Tech were formally indicted in May for running a fraudulent ICO, with charges of securities fraud, wire fraud, and two conspiracy counts. The company raised $32 million from investors in 2017. The defendants had misled investors by falsely claiming that their company had partnered with Visa and MasterCard to issue virtual currency debit cards.",2
Korean Ministry Launches Probe Into Causes of Bithumb Crypto Exchange Hack,Marie Huillet,2018-06-20 22:55:21,8649,199,"The South Korean Ministry of Science and Technology (MIC) has launched an investigation into the theft of $30 mln from the world’s sixth largest crypto exchange Bithumb, Yonhap News reports Wednesday, June 20.Bithumb, which is the leading crypto exchange in South Korea, temporarily suspended all deposits and payments on the exchange as soon as it had detected the theft.According to Yonhap, the Ministry has said that as soon as it reported the Bithumb hack, the Korea Internet & Security Agency (KISA) joined an urgent investigation into the case. The Ministry now plans to analyze the causes of the theft in cooperation with the police and other agencies.MIC says it has been investigating the security levels of 21 crypto exchanges between January and March of this year, and has confirmed that most of them have security vulnerabilities.These weaknesses include insufficient network isolation, an absence of monitoring systems for abnormal or suspicious activities, and inadequate cryptographic key and password security management. In 12 exchanges, the MIC found the complete absence of a security system.In a separate incident earlier this month, hackers stole around $37 mln from another South Korean crypto exchange Coinrail, which ranked 99th largest globally by trade volumes at the time of the theft. According to Yonhap, the MIC has said that the improvement measures recommended to Coinrail have not been properly implemented during the investigation, and that it now plans to monitor Bithumb’s own response.In addition, the MIC has said that as of the end of this month, it plans to closely follow those 21 exchanges it has been monitoring for security weaknesses, and ensure they improve their practices by September.According to Cointelegraph’s personal correspondence with Korean resident officials from the Sentinel Protocol, Bithumb’s hot wallet was hacked on the night of June 19.Prior to the hack, Bithumb had moved a large amount of Ethereum to cold wallet storage after noticing abnormal access on its servers, also announcing an abrupt server check June 16 “in order to maximize security settings.”As Cointelegraph reported, the exchange has said it will compensate users affected by the hack:“We checked that some of cryptocurrencies valued about $30,000,000 was stolen. Those stolen cryptocurrencies will be covered from Bithumb and all of assets are being transferring to cold wallet.”",[]
"World’s Sixth Largest Crypto Exchange Bithumb Hacked, Loses $30 Mln",Aaron Wood,2018-06-21 10:31:05,31848,580,"Hackers have stolen cryptocurrencies worth $30 million from South Korea's leading virtual currency exchange Bithumb, Cointelegraph Japan reported June 19. As a result all deposits and payments have been temporarily suspended.*All deposit and withdrawal service will be stopped to make sure the security. We will keep notice you of the restart of the service. We apologize for your inconvenience and thanks for your understanding.The exchange states it will compensate users affected by the hack, and that all assets are being moved to a cold wallet:“[Notice for the suspension of all deposit and withdrawal service]We checked that some of cryptocurrencies valued about $30,000,000 was stolen. Those stolen cryptocurrencies will be covered from Bithumb and all of assets are being transferring to cold wallet.”Bithumb moved a large amount of Ethereum to its cold wallet when they recently noticed abnormal access. On June 16, Bithumb announced an abrupt server check “in order to maximize security settings.” The maintenance was planned from 5:20 am KST to 9:00 am KST, but exceeded the scheduled time.According to Cointelegraph’s personal correspondence with Korean resident officials from the Sentinel Protocol, a project specializing in hacking, scam, and fraud detection, the hot wallet was hacked on the night of June 19 and some of the stolen coins include Ripple.According to CoinMarketCap, Bithumb’s 24-hour trade volume at press time is over $374 million, the world's sixth largest.Earlier this month, hackers stole around $37 million from South Korean crypto exchange Coinrail. While Coinrail was only ranked the 99th largest crypto exchange in the world in terms of trade volume, some in the media claimed the hack was responsible for crashing crypto markets. Industry journalist and commentator Joseph Young said:“[The Wall Street Journal] thinks Bitcoin price fell 11% because a small cryptocurrency exchange in South Korea which a very small portion of local users utilize was hacked. Bitcoin fell because people sold and not enough people were willing to buy, not because of a small hack.”",3
"Self-Advertised as Turkey’s ‘National Cryptocurrency,’ Turcoin Outed as Ponzi Scheme",William Suberg,2018-06-20 17:42:10,10540,226,"Turcoin, advertised by its creators as Turkey’s “national” cryptocurrency, has been outed as a ponzi scheme, Hürriyet Daily News reports Monday, June 18.Muhammed Satıroğlu, a major shareholder of the company that launched the coin has told the media it “doesn’t have a single dollar in the bank.”Istanbul-based company Hipper, whose partners Muhammed Satıroğlu and Sadun Kaya launched ‘Turcoin’ in 2017, is the subject of a criminal complaint after payouts to investors stopped in early June 2018.Speaking to local outlet Hürriyet Daily News, Satıroğlu, who owns a 49 percent stake in Hipper, claimed he was “only a mediator” in Turcoin and that Kaya had run off the the cash, which totals 100 million lira ($21 million).“I was only a mediator. Our company Hipper does not even have a single dollar in the bank. All the money went to Sadun Kaya’s company in Cyprus,” he told the publication.Kaya has allegedly stopped responding to calls and disappeared. Satıroğlu protests his innocence, despite appearing to hint he does in fact have access to some form of investor funds:“I have not fled with the money. I will return all the money to the members if authorities unblock my bank accounts,” he added.Turcoin promised to become Turkey’s “national cryptocurrency” upon its launch, wooing investors with high-budget parties attended by celebrities and giveaways of luxury cars, some of which have since been outed as borrowed.Earlier this year, Turkish politicians also floated the idea of an official national cryptocurrency, suggesting to call it ‘Turkcoin’.",1
Report: $1.1 Bln in Crypto Has Been Stolen This Year,Ana Alexandre,2018-06-08 12:19:46,24048,280,"Cybersecurity company Carbon Black announced that roughly $1.1 bln worth of digital currency has been stolen in the first half of 2018, CNBC reported June 7.The security company said that criminals take advantage of the dark web to facilitate large-scale cryptocurrency theft. Estimates reportedly show that there are 12,000 marketplaces and 34,000 offerings associated with cryptotheft hackers can take advantage of. The dark web can be only accessed with the application of special software and allows users to stay anonymous and mostly untraceable.Carbon Black Security strategist Rick McElroy, who was interviewed by CNBC, said that basic malware costs an average of $224 and can be priced as low as $1.04. McElroy added that it even sometimes comes with a form of customer support. According to the report, the malware marketplace is worth $6.7 mln.The report notes that thefts can be carried out by organized crime cartels or criminal gangs, but often it’s a highly-trained engineer who works alone and is looking for a means of supplementary income. As explained by McElroy, cyber-theft is “pretty easy to do” and anyone could be capable, not only notorious hacker groups. He added:""You have nations that are teaching coding, but there's no jobs. It could just be two people in Romania needing to pay rent.""Unlike banking and conventional financial operations, cryptocurrency holders do not have institutional support to protect their savings or cover their losses in case of a fraud or hacker attacks. McElroy said:""Usually we rely on banks, the tools are out there but investors need to know how to do this. A lot of people are unaware in this new gold rush, people are using cloud wallets and not securing their money.""Per the study, exchanges were the most popular target for cybercriminals this year, making up 27 percent of attacks.Yesterday Cointelegraph reported that GuardiCore security team discovered a malicious traffic manipulation and cryptocurrency mining campaign. The campaign called Operation Prowli infected over 40,000 machines across various industries, including finance, education, and government.",4
"Operation Prowli Malware Infects Over 40,000 Machines, Which Were Used for Crypto Mining",Ana Alexandre,2018-06-08 04:40:14,17550,222,"The GuardiCore security team has discovered a malicious traffic manipulation and cryptocurrency mining campaign, according to an announcement published June 6. The campaign infected over 40,000 machines across various industries, including finance, education, and government.The campaign called Operation Prowli used various techniques like exploits and password brute-forcing to spread malware and take over devices, such as web servers, modems, and Internet-of-Things (IoT) devices. GuardiCore found that the attackers behind Prowli were focused on making money rather than ideology or espionage.According to the report, the compromised devices were infected with a Monero (XMR) miner and the r2r2 worm, a malware that executes SSH brute-force attacks from the hacked devices, and backs the Prowli to affect new victims. In other words, by randomly generating IP address blocks, r2r2 tries to brute-force SSH logins with a user/ password dictionary, and after breaking in runs a series of commands on the victim. The GuardiCore wrote:""The attacks all behaved in the same fashion, communicating with the same C&C server to download a number of attack tools named r2r2 along with a cryptocurrency miner.""Additionally, cybercrooks used an open source webshell named “WSO Web Shell” to alter the compromised websites to host malicious code that redirects site visitors to a traffic distribution system, which then redirects them to various other malicious sites. Once redirected to a fake website, users fell victim to clicking on malicious browser extensions. The GuardiCore team reported that Prowli managed to compromise more than 9,000 companies.Last month, a new piece of cryptojacking malware used half a million computers to mine 133 Monero tokens in three days. Cyber security firm 360 Total Security discovered that the malware, referred to as WinstarNssmMiner, presents a fresh challenge to users, due to its ability to both mine and crash infected machines.",[]
"Belgian Gov’t Launches Website to Warn Public About Crypto Scams, Risks",Helen Partz,2018-06-06 14:35:26,11565,187,"Belgian authorities have launched a website to raise awareness of the risks associated with investments in crypto, the FPS Economy (FPS) announced in a public statement June 5.The FPS noted the sharp spike in interest towards crypto investments, which they said “causes a lot more people to be scammed.” According to the statement, Belgian investors reported the loss of €2.2 mln ($2.5 mln) in crypto scams to the FPS last year. The FPS said that this is “just the tip of the iceberg” as only 4 percent of crypto fraud cases are reported. Per their estimations, investors in Belgium lose about €130 mln ($152 mln) to scam crypto projects per year.The website ""Too Good to Be True"" from FPS Economy and the Federal Services and Markets Authority (FSMA) warns the public about crypto investment risks, stressing that crypto fraudsters usually “promise big profits,” and “often seem reliable.” The website encourages potential crypto investors to carefully check the details of the projects before investing as well as to be “cautious when paying online with cryptocurrencies.”The website offers a portal with which users can report instances of scammy companies, in addition to a scanner that screens websites for complaints of fraud.The site claims that “the absence of [a] warning about a company” after checking does not necessarily mean that the crypto project has a “valid license,” and that it may require further consideration. The site says that companies will sometimes change their names in order to avoid appearing on lists of fraudulent or scammy projects.Last month, the office of Investor Education and Advocacy at the US Securities and Exchange Commission (SEC) launched a fake initial coin offering (ICO) website to increase awareness of the typical warning signs of scam ICOs and to promote investor education. The website of so-called “HowieCoins” included archetypical details of a scam ICO, including a misleading and blurry white paper, guaranteed returns claims, and celebrity endorsements.",[]
"South African Police Investigate Alleged Crypto Ponzi-Scheme Involving 28,000 Investors",Marie Huillet,2018-05-28 14:05:13,41299,365,"South African Police are pursuing an alleged major cryptocurrency investment fraud, according to a police statement released yesterday, May 25. According to the statement, over 28,000 investors are said to have suffered losses exceeding 1 bln rand ($80.4 mln).The Hawks, an investigative unit of South Africa’s Directorate for Priority Crime Investigation (DPCI), have outlined the case, which they say involves “BitCaw Trading Company, commonly known as BTC Global”:“[Targeted members of the public are believed to have been] encouraged by BTC Global agents to invest with promises of 2% interest per day, 14% per week and ultimately 50% per month. Payments were allegedly made every Monday. Some of the investors got paid in terms of the agreement. However, the payments suddenly stopped.”Based on these unrealistic promises, a 4% referral program, and other warning signs, marketing agency SEO Spark last year contended that BTC Global was a fraudulent Ponzi-scheme, predicting investor losses.BitCaw Trading has denied the company has had any involvement with BTC Global, telling Bloomberg that “BitCaw Trading […] do[es] not manage third-party money or offer any kind of investment […] We are shocked to see our name connected with [the alleged scam].”According to BTC Global’s website, the blame for the abruptly terminated payments lies with an elusive former admin member, who the company claims it “cannot locate,” continuing:  “We are as shocked and angry as everyone. But we all knew the risks involved in placing funds with Steven. We all became complacent with Steven. And all of us funded him independently. Until Steven Twain resurfaces or is found there is nothing the admin team can do...”The Hawks’ Lieutenant general Yolisa Matakata is calling on any further affected investors to come forward. “This may prove to be the tip of the iceberg with potentially thousands more yet to discover they’ve lost money,” he said in the statement.Yesterday, May 25, Cointelegraph reported that South Africa’s central bank has chosen to call cryptocurrencies “cyber-tokens” because they “don’t meet the requirements of money.”The U.S. government has moved to more actively educate investors against crypto-related fraud, specifically involving Initial Coin Offerings (ICOs). The U.S. Securities and Exchange Commission (SEC) recently launched a website for a fake ICO that was constructed to imitate classic “red flags” of fraudulent token sales.",2
"South Africa: Gang Kidnaps 13 Year Old Boy, Demands Ransom of 15 Bitcoins",Marie Huillet,2018-05-24 09:00:15,16420,241,"The kidnappers of a 13-year-old boy in South Africa have demanded a ransom of 15 bitcoins (BTC) - around $120,000 - for his release, The Guardian reported Tuesday, May 22.Local police stated that on Sunday, May 20, three gang members pulled up in a car near to where the teenager, Kathlego Marite, was playing with two friends close to his home in the town of Witbank. Witnesses said the men dragged him into the vehicle, leaving their ransom note at the scene. The “non-negotiable” note reportedly threatens to kill the boy if the demands are not met, with the first deadline for payment passing on Monday.Local media quoted Brigadier Leonard Hlathi as saying that the family is “going through trauma”:""They don’t even know what this Bitcoin is. They’re devastated and you can see they’re worried and asking themselves, 'where’s our son?'""The Guardian reports that the case is the first ransom demand for cryptocurrency in the country’s history.Late last year, Pavel Lerner, the managing director of crypto exchange EXMO was released after a $1 mln ransom in Bitcoin was paid to a gang who had abducted him while he was leaving his office in Kiev, Ukraine. That same month, the perpetrator of an attempted package bombing in Germany sent a note via DHL demanding a €10 mln ransom to be paid in Bitcoin.Bitcoin has also allegedly been an increasingly popular form of ransom demanded by cybercriminals, with widespread fears of the high-profile WannaCry ransomware causing companies globally to “stockpile” the cryptocurrency preemptively last year.",4
Chinese Prosecutors Charge Final Suspects In $2.3 Bln OneCoin Investigation,Molly Jane Zuckerman,2018-05-24 08:25:17,15038,248,"The last four suspects in a two year case against alleged pyramid scheme OneCoin have been prosecuted in China’s Hunan Province, government-supported local news source the Justice Network reports Wednesday, May 23.The Zhuzhou Country Procuratorate of the Hunan Province examined 106 people, publicly prosecuted 98, and recovered around 1.7 bln yuan (around $266 mln) from over 20 provinces across China in the course of the case. Those prosecuted have received up to 10,000  - 5 mln yuan in fines (about $1,500 - $782,000) as well as four years or less of prison time.In 2016, Chinese authorities had already seized over $30 mln dollars during their investigation of the alleged pyramid scheme.The Justice Network reports that OneCoin organization - “Weika Coin” in China - whose server is located in Copenhagen, Denmark, worked by “constantly induc[ing] new investors to realize imaginary high profits” by “deceptively advocating” the coins’ worth and “tempting others to invest huge sums of money into its established website.”The pyramid scheme, or MLM organization, reportedly had 27 fund pool accounts, more than 140 member levels of varying costs, and a total of over 2 mln registered users located in China. In total, the funds involved in the scheme are more than 15 bln yuan (around $2.3 bln), according to the Justice Network.Last fall, Italy imposed a €2.5 mln fine on OneCoin after the Italian Antitrust and Consumer Protection Authority (AGCM) branded the organization a pyramid or ponzi scheme.More recently, in January of this year representatives of the Bulgarian law enforcement as well as European Union crime fighting units raided OneCoin’s office in Bulgaria at the behest of a German prosecutors office. While documents and servers were seized from the offices and 50 witnesses questioned, no arrests were made at the time.Back in 2015, Cointelegraph warned readers to stay away from OneCoin, referring to it as likely to be a scam.",7
