title,author,dt,views,shares,abody,comments
How Investors Can Protect Themselves Against Bitcoin Scams,Iyke Aru,2016-06-29 16:05:00,501,196,"To safeguard themselves from scams within the cryptocurrency ecosystem, investors must avoid being greedy, be logical in their analysis of opportunities and dedicate time and resources to research and education.Complaints about loss of investments within the crypto space is becoming a common occurrence. As a result,  online investment companies which deal with cryptocurrencies have recently become increasingly perceived with a negative bias. Scammers these days seem to ride on the anonymous characteristics of the industry to deceive unsuspecting investors.The latest incidence involved a supposed Bitcoin cloud mining company Hashocean whose website was inaccessible for about five days. Also, among the supposed scammers is OneFxZone, a self-acclaimed trading company who still claim to be honest, but their investors complain of their inability to access their funds.Cointelegraph asked experts why scams now seem to be on the increase and how potential investors can figure out which prospect is genuine and which is not.Co-Founder and Director at SatoshiLabs, Alena Vranova tells Cointelegraph that the rise of scams and Bitcoin thefts come hand-in-hand with the rising price of Bitcoin.“The correlation was shown clearly in the Dell Secure Works research conducted in early 2014.”Vranova identifies the three most common areas where Bitcoin thefts or scams occur as: through a third-party fraud, digital exposure and human error or ignorance. She says that the digital and third-party risks can be easily mitigated today with a hardware wallet such as TREZOR while distributing the risk is usually a good common practice in any investment.  “Some voices call for more regulation against fraudsters exploiting poorly informed clients. I am quite opposed to that idea. In  any financial services and investment opportunities, a fraud is very common, and the Bitcoin world is not an exception. As a ‘small’ example we can look at the insurance industry. The UK represents over 7% of the global insurance market and faces over 2 billion pounds in insurance fraud annually. Let's assume that the global scale of insurance fraud could be around 20 billion pounds. Now, most of those frauds are done with the help or direct involvement of independent insurance brokers and agents who usually obtain their licenses from a central bank or a similar state-regulated organization. On top of the losses, insurance companies are investing hundreds of millions into fraud prevention and legislators invent new obscure ‘consumer protection’ rules. Yet  the preventive effects of the latter are questionable and the cost of insurance only rises.”However, Vranova points out that most investors do not realise their proper position and level of vulnerability once signed-up for any such investment packages.“Unfortunately people don't realize that it's not their funds when they transfer their Bitcoin (or money) to someone else's account: ‘It is only a promise to hold and eventually grow the sum for me.”In conclusion, Vranova says that the good news for Bitcoin is that it may be actually less prone to fraud than the US dollar or Euro. As Bitcoin is an open ledger and an open community, it is relatively easier to get feedback from the community, do research on the companies, their teams and investment parameters before making decisions.The Founder of Cryptopay, a UK Bitcoin payment gateway, George Basiladze, says that the only thing which is responsible for online scams is people’s greed.According to Basiladze, most of the scam projects and Ponzi schemes are so easy to expose as long as greed does not get in the way. He also points out that anybody willing to undertake any form of investment must seek to understand the specific market and exercise patience.He says:“Investors need to be reasonable and seek to understand the world of capital markets, and get educated. Another thing investors should know is that you cannot get rich quickly or get 7000% ROI without being scammed. Everything needs time and patience.”Aleksandar Matanovic of EC District Financial Services also tells Cointelegraph that a lot of people have fallen victim to online scams due to their attraction to various testimonials of other investors who may have truly earned a lot of money within the crypto industry.He says:“There are lot of true stories about people who have earned huge amounts of money with Bitcoin, whether it is through mining, trading or something else. Because of those stories, people know it is possible to make fast profits with Bitcoin and so they are more susceptible to scammers and their schemes which promise big returns on investments.”However, Matanovic advises any investor to be logical when seeking genuine ventures. He also identifies greed as the factor which can cloud logical reasoning when it comes to investments:“Investors should think clearly and not let their logic be pushed aside by their greed. I mean, there are schemes offering 10% daily; can someone actually believe that it is not a scam unless he/she is totally blinded by greed? People need to know that every single chance to make profits comes with a certain risk. And, of course, they should invest only what they are ready to lose, because if they are totally new to Bitcoin and eager to invest ASAP without dedicating some time to research, they will probably lose.” ",[]
Major Bitcoin Miner Disappears Along with Millions of Dollars Worth of Bitcoin,Olusegun Ogundeji,2016-06-27 10:15:00,1674,1997,"Usual website activities of a major Bitcoin miner Hashocean are nowhere to be found, fuelling suggestions that the cloudminer is a scam.According to ‘Is It Down Right Now’ which monitors the status of favorite web sites and checks whether they are down or not using the test tool below, as well as graphs and users’ comments, Hashocean has been down for more than five days.A visit to the Hashocean website shows the ‘403 Forbidden cloudflare-nginx’ message. “Hashocean.com is PARKED,” ""Is It Down Right Now"" says. “The website is either expired or listed for sale...” As at the time of this publication, it says the Hashocean site has been down for about 5 days 19 hours. Its youtube and Facebook pages have also been removed.Now, based on the assumption that the miner has disappeared with the money invested by its subscribers - reportedly about 700,000 of them, several comments have trailed Hashocean’s sudden disappearance.OrionOverwatch writes on Reddit:“I calculated how much money they ran away with. They pay around 1900 Bitcoins every single day during the last couple of days and they received about 2200 a day, except from yesterday which is probably why they shut down. Looking at the different dates and making a rough estimation it's pretty easy to find out they earned on average about 140 Bitcoins a day during roughly 20 months which would be a cool 50M$. (it's probably around 35M$ and 65M$). They will probably sell a small number of the Bitcoins every day which will obviously make the price per Bitcoin decrease significantly during the next days, months or even years. Kind of a pessimistic opinion but a realistic one.”Spoonfednonsense says:“Yeah I lost 1.75 Bitcoin myself. Saw it coming with the Halving coming up. I even knew it was a Ponzi scheme (a fool and his money are easily parted, is the lesson I learned from this one.”Another posted a link to the report on the site’s domain registration details which cite Richard Maisano as its owner and seeking to get the issue reported to the relevant authorities.However, despite the gloomy view to it, some are still hopeful.Johann Steynberg in his comment on www.isitdownrightnow.com, writes in response to another comment which suggested through a link that the miner will be back soon:“Thank you. Let's wait and see what happens when the new payment run is due. Only then will we be able to know for sure.”",26
Fear and Panic As Online Trading Company Loses Trust of Investors,Iyke Aru,2016-06-07 11:30:00,371,50,"The inability to access funds and a sudden change of contract terms and conditions without notice has thrown investors within the online trading company, OneFxZone into panic mode.Originally known as OneFxZone, ‘One International Limited’ is a company that claims to trade in Foreign Exchange and welcomed investors with a promise of various attractive returns on investments. OneFxZone accepted deposits in Bitcoins, Paypal, Bank wire, etc.Launched in November 2015, OneFxZone boasted of very efficient and easy operational procedures until about five months after existence.“I signed up on OneFxZone in November 2105, sponsored by Kyle Gibson. My initial investment was $25 only and at the time of investment expiry I had earned up to $400. That was when the programme was doing well,” says Hameed Olaniyi Ogundipe.Another investor from Nigeria who chose to remain anonymous tells Cointelegraph that he was signed up by the same Kyle Gibson in March 2016. According to him, at the point of entry, every detail of the contract was clear and straightforward until the beginning of May 2016, when adjustments began to take place without prior notification.Originally known as a forex trading company that allowed investors to cash out their earnings on a weekly basis, five months after existence, OneFxZone announced its expansion and introduction of new investment packages with claims to be trading in gold as a commodity and an improved additional investment opportunity.Less than two hours before the opening of the cashout period on Monday May 9, 2016, investors were greeted with the news that they could not make withdrawals anymore until the 5th of the coming month as the rules had changed from weekly to monthly withdrawal dates.“After the change in system without adequate notice, I became uncomfortable with the scheme. I went a step further to research, only to discover that certain online profiles within the company were pseudo identities. Fake names of people who never existed. At this point it dawned on me that I had been scammed!” says an investor.Latest among the disheartening news to investors is the development that no further withdrawals can be performed unless an individual’s account is ‘verified’, a process which involves the submission of certain required documents and a will, unlike what is required elsewhere, a process which takes three months.Investors who spoke to Cointelegraph complained about the impromptu nature of these developments, and the timing of such announcements which happens to coincide with the coming cashout period.Ogundipe expressed his lack of trust for the system at the moment. He says:“At the beginning of the program, I was given full support by the founder and admin, I was given the assurance that the whole plan was long term. That for me was the catch.Having had several experiences, I had to be smart. Hence my little deposit. But at this point, it is clear that most investors will not have their accounts verified until the expiration of their contracts. Obviously, something is not right.”Several complaints from participants in a Facebook chat group who have all invested into the scheme have been ignored by the usually prompt ‘live support’ chats on the company’s website, and there have been non-approval of uploaded verification documents and multiple non-access pop-ups on the website.Maybe this is a well executed plan to defraud unsuspecting investors, or maybe it is just a phase within the company’s development. One thing is certain - affected investors’ worries that all their invested wealth is gone with the wind are not unwarranted.",[]
"Beware: 4 Typical Bitcoin Scams in Mining, Investment, Wallets, Exchange",Shivdeep Dhaliwal,2016-03-24 09:33:00,9092,190,"We have collected four typical scams to remind you that Bitcoin is just cash, and you should take care to use it as real money: Carefully. Most frauds and scams don’t happen because of the technology involved but rather due to the underlying greed and callousness on the part of the users.There is something about Bitcoin that attracts all kinds of scam artists and frauds. It even has the potential to turn secret service agents into thieves.In December 2015 ex-Secret Service agent Shaun Bridges was sentenced to nearly six years in prison after pleading guilty to money laundering and obstruction charges in connection with the theft of more than $820,000 in bitcoin from accounts connected to the Silk Road. Now the US government believes that he may have been involved with additional thefts from the now-defunct online dark market:""...the US had recently become aware of additional thefts of bitcoins from Secret Service accounts, the facts of which led the government to believe that Bridges, working with others, was also involved in these thefts.""US District Judge Richard Seeborg, who presided over the case, remarked that from what he could see, this crime had been motivated by greed. “No departure or variance is warranted in this case,” he said.Why Bitcoin attracts thugs? Very simply because of its very nature. You can remain anonymous while conducting Bitcoin transactions and there is no chargeback mechanism built into the virtual currency. We would like to emphasize here the word currency because it is akin to paying with cash. Reversals and chargebacks are more talk of the plastic money domain.A study done by researchers at the Southern Methodist University in Texas, USA in January 2015 reveals a great deal about common Bitcoin scams and how people fall victim to them. The research was conducted by Marie Vasek and Tyler Moore and is titled There's No Free Lunch, Even Using Bitcoin: Tracking the Popularity and Profits of Virtual Currency Scams.  The research revealed 41 scams that occurred between 2011 and 2014 in which 13,000 victims fell prey to fraudulent websites. The amount of money lost in this period was nearly a conservative USD 11 million.We looked at the findings of Marie Vasek and Tyler Moore and here are their key findings. The common element among all these scams though is greed and naivety on the part of the users:1. Bitcoin Investment Programs: If it is too good to be true it probably is not goes the old adage and it is as true today as it was in the past. When people are promised higher yields on their deposits, they are often swayed by greed.You should be wary of wallets that offer returns if you keep money in them or if some investment program gives you way more returns than the prevalent market rates.2. Bitcoin Mining Scams: A lot of mining operations are alleged to be scams but to narrow down the definition mining scams can be described as operations, which take a fee to mine Bitcoin on your behalf but never deliver. Cloud mining particularly has been in the eye of the storm. Researchers Moore and Vasek:“Active Mining and Ice Drill are operations that raised money to purportedly make ASICs and share the profits but never delivered. AsicMiningEquipment.com and Dragon-Miner.com are fraudulent mining e-commerce websites.”3. Bitcoin Wallet scams: Getting pickpocketed sucks but having your money vaporize under your very nose is brutal. The usual modus operandi of scam wallets is that the victim deposits Bitcoin into such a wallet and when it reaches a certain threshold; the money is transferred to the scamster’s wallet. In its analyses of fraudulent Bitcoin wallets, the report states that:“We were able to analyze three of these services (Onion Wallet, Easy Coin, and Bitcoinwallet.in), in which all transfers from the victims were ultimately delivered to the same address held by the scammer. These particular scams advertise themselves as offering a mixing service that enhances transaction anonymity for customers. In fact, all three services appear to be operated by the same scammer, because the siphoning transfers all go directly to the same Bitcoin address.”4. Bitcoin Exchange Scams: Exchanges are the point of entry into the Bitcoin universe and many victims of scams are attracted to lower exchange rates, promises of anonymity or offerings such as PayPal or Credit Card processing that other exchanges may not offer.Once the victim deposits payment for buying Bitcoin, they never actually receive their cryptocurrency leaving them high and dry. Most fraudulent exchanges seem to have a short life span.",7
Next BTC Scam Wants You: What Makes People Fall Into Financial Traps,Julián Bordet,2016-03-14 17:28:00,810,44,"As the number of new Bitcoin users and transactions grow, the number and sophistication of scams in the community continues to reach new heights. Why are so many people getting scammed over and over again?There are a lot of reasons that explain the why people hand their money to total strangers so easily. One of the prime facts that come into play is that a lot of bitcoin users have joined the network in the post-thousand dollars per bitcoin era. These consumers feel that they have missed the train and desperately want to make up for it, which puts considerable psychological pressure to want to believe too-good-to-be-true stories.Think of the average Joe that has tens of thousands of dollars of student loan debt following them around, month after month deeper in the red, shocked to find out that his newly acquired college degree only lets him earn a couple of dollars above minimum wage.These people are desperately wishing for a miracle, and when they find such an innovative and disruptive technology as bitcoin, considered by many to be able to replace the most established and powerful corporations in the word, they are no different than a dehydrated man in the middle of the Sahara desert who just saw an oasis on the horizon.Now we have people wishing for a miracle on an everyday basis. They suddenly find themselves with cutting-edge technology on their hands, technology that, although they do not entirely understand it, makes them feel that they are in charge of their own lives once again after so long. At first they feel like bank’s doomsday bringers, but after a while, the emotion gets cold and the old problems are still there. This is the critical moment when lots of people hear about High Yield Investment Programs, or HYIP for short, for the very first time.Scammers come in lots of shapes and sizes, and so do their operations, but they all have one thing in common: they are very good social engineers. These guys know exactly the right buttons to press to get their unaware victim’s attention, as well as how eager their innocent counterpart is to find a magical solution to their financial distress.Scammers and their HYIPs fool people into thinking that only by pressing a couple of buttons on a keyboard, all their problems will be solved. They offer them redemption. Not everyone who falls into the hands of a scammer are over-indebted people though. There are also those who fancy themselves to be Hollywood-like hedge fund managers.This particular type of victim usually thinks they are smarter than the rest but for some unknown reason life is not rewarding them as it should. So, when they find out that some shady website offers 50% monthly returns on their ‘investment’, after playing for a couple of minutes with their smartphone’s calculator app, they hand out their money no questions asked.So, after the inevitable takes place and tears begin to fall, people start wondering why this happened to them. The answer most of the time is that they were using a technology that they didn’t fully understand and let themselves be fooled by their eagerness for last minute salvation. If bitcoin ever taught me anything, it is the power of the word ‘trust’.At the end of the day, the victim learns an important maxim: there are no magical solutions to problems, be they financial or otherwise. If you have fallen into one of these deceptions, don’t get depressed over it, absorb the experience and move on with your head held high, knowing that you are wiser than before. After all, you now have the means and the knowledge to be your own bank.",[]
Bitstamp Uncovers Bitcoin-Stealing Chrome Extension,Charlie McCombie,2016-03-14 11:22:00,534,5,"The Slovenia-based Bitcoin trading platform, Bitstamp, revealed in a Tweet that it had uncovered a Google Chrome extension that replaced all QR codes. It linked to Bitcoin addresses and then linked to the thief’s wallet. This is not the first time criminals have attempted to steal Bitcoin via Google Chrome extensions.On March 11, Bitstamp released a Tweet that said it had discovered a Google Chrome extension called ‘BitcoinWisdom Ads Remover’ that “will try to steal your Bitcoin”:Be careful! We have uncovered a Chrome extension called BitcoinWisdom Ads Remover that will try to steal your #bitcoin.Members of the Bitcoin community were quick to investigate the claims, with Devon Weller, a cryptocurrency web app developer saying:“Confirmed. I looked at the source code. It replaces QR code images on bitcoin exchanges with its own addresses.”Further investigation by Reddit user, /u/methamphetaminic, revealed some interesting developments. They discovered that the browser extension had about 200 bitcoin addresses hard-coded into it, but only 3 transactions had made their way to the scammer’s wallet; payments of 0.00433517 BTC from 1FosyhE1WvDxTBjA6e4a8N6yJ5MkZgDgUZ, 0.00186735 BTC from 1ExHFeLBKxmqtfi5mEd6ov6a5vBaBuHCYH, and of 0.07805963 BTC from 1MaUiURfN7pytCTC1FnHRSZ13N6AzXVszp, all of which took place in July 2015.The Redditor surmised that these were probably test payments by the scammer to ensure his payment system worked. They also suggested that, given the lack of transactions going into the scammer’s wallet, the scamming operation can’t have been all that successful or profitable.Interestingly, something not seen in previous Google Chrome extension scams, the extension didn’t simply try to replace all addresses and QR codes with the the scammer’s, but instead only targeted addressed on sites including bitstamp.net, btc-e.com, and hasnest.com. Some have suggested that the scammer probably had some personal grievance against one or more of these sites, and such wanted petty revenge. This Redditor in particular theorised that it could be “somebody who hates ads on bitcoinwisdom, [or] maybe a miner who also deals with bitstamp and btc-e in particular.”This is far from the first time that scammers have tried to steal users’ Bitcoin using Google Chrome extensions. In April 2014, an extension entitled ‘Cryptsy Dogecoin Live Ticker’ released an update to its semi-popular chrome extension that had code in in that rerouted Bitcoin transactions again to the scammer’s wallet instead of the intended recipient. The extension, developed by TheTrollBox, was quickly removed from the Chrome Store by Google, along with the developer’s 21 other extensions, which were all various variations on the ‘Live Ticker’ name.",[]
